{
  "taskId": "DCS-001",
  "state": "ANALYSIS",
  "attempt": 0,
  "timestamp": "2026-08-31T18:51:23.303Z",
  "gitRef": "WORKTREE",
  "changedFiles": [
    "Task document (DCS-001)",
    "Repository evidence (within read scope)"
  ],
  "decisionRefs": [],
  "discoveries": [
    "Task requires an audit of the current system.",
    "No modifications to source files, implementation files, or packages are allowed.",
    "No refactoring, commits, or pushes are permitted.",
    "Workflow state must not be modified manually."
  ],
  "knownProblems": [
    "Task may be incomplete if the audit is not performed thoroughly.",
    "Misinterpretation of the task document may lead to incorrect classification of capabilities."
  ],
  "nextAction": "Execute the current-system audit based on the task document and repository evidence within the read scope."
}
